query_type,query,col_1,col_2,df_command
Sorting & Ranking,Get bottom 10 employees based on revenue.,employees,revenue,"df.sort_values(by='revenue', ascending=True).head(10)"
Sorting & Ranking,Sort customers by profit in descending order.,customers,profit,"df.sort_values(by='profit', ascending=False)"
Sorting & Ranking,List the lowest profit values grouped by employees.,employees,profit,"df.sort_values(by='profit', ascending=True)"
Sorting & Ranking,List the lowest revenue values grouped by employees.,employees,revenue,"df.sort_values(by='revenue', ascending=True)"
Sorting & Ranking,Show departments in increasing order of profit.,departments,profit,"df.sort_values(by='profit', ascending=True)"
Sorting & Ranking,Find top 3 products with highest profit.,products,profit,"df.sort_values(by='profit', ascending=False).head(3)"
Sorting & Ranking,Find top 3 customers with highest revenue.,customers,revenue,"df.sort_values(by='revenue', ascending=False).head(3)"
Sorting & Ranking,Sort stores by rating in descending order.,stores,rating,"df.sort_values(by='rating', ascending=False)"
Sorting & Ranking,List the lowest expenses values grouped by departments.,departments,expenses,"df.sort_values(by='expenses', ascending=True)"
Sorting & Ranking,Display departments in order of decreasing profit.,departments,profit,"df.sort_values(by='profit', ascending=False)"
Sorting & Ranking,Find top 3 employees with highest profit.,employees,profit,"df.sort_values(by='profit', ascending=False).head(3)"
Sorting & Ranking,Show products in increasing order of revenue.,products,revenue,"df.sort_values(by='revenue', ascending=True)"
Sorting & Ranking,Display customers in order of decreasing rating.,customers,rating,"df.sort_values(by='rating', ascending=False)"
Sorting & Ranking,List the lowest expenses values grouped by departments.,departments,expenses,"df.sort_values(by='expenses', ascending=True)"
Sorting & Ranking,Find top 3 products with highest expenses.,products,expenses,"df.sort_values(by='expenses', ascending=False).head(3)"
Sorting & Ranking,Display departments in order of decreasing sales.,departments,sales,"df.sort_values(by='sales', ascending=False)"
Sorting & Ranking,List the lowest units_sold values grouped by products.,products,units_sold,"df.sort_values(by='units_sold', ascending=True)"
Sorting & Ranking,Show departments in increasing order of revenue.,departments,revenue,"df.sort_values(by='revenue', ascending=True)"
Sorting & Ranking,List the lowest revenue values grouped by departments.,departments,revenue,"df.sort_values(by='revenue', ascending=True)"
Sorting & Ranking,Show customers sorted by rating ascending.,customers,rating,"df.sort_values(by='rating', ascending=True)"
Sorting & Ranking,Get bottom 10 products based on expenses.,products,expenses,"df.sort_values(by='expenses', ascending=True).head(10)"
Sorting & Ranking,List top 5 departments by profit.,departments,profit,"df.sort_values(by='profit', ascending=False).head(5)"
Sorting & Ranking,List top 5 customers by rating.,customers,rating,"df.sort_values(by='rating', ascending=False).head(5)"
Sorting & Ranking,Get bottom 10 products based on rating.,products,rating,"df.sort_values(by='rating', ascending=True).head(10)"
Sorting & Ranking,Rank stores by revenue.,stores,revenue,df['revenue_rank'] = df['revenue'].rank(ascending=False)
Sorting & Ranking,Show employees sorted by units_sold ascending.,employees,units_sold,"df.sort_values(by='units_sold', ascending=True)"
Sorting & Ranking,Rank customers by units_sold.,customers,units_sold,df['units_sold_rank'] = df['units_sold'].rank(ascending=False)
Sorting & Ranking,Find top 3 employees with highest rating.,employees,rating,"df.sort_values(by='rating', ascending=False).head(3)"
Sorting & Ranking,Show departments in increasing order of expenses.,departments,expenses,"df.sort_values(by='expenses', ascending=True)"
Sorting & Ranking,Rank products by profit.,products,profit,df['profit_rank'] = df['profit'].rank(ascending=False)
Sorting & Ranking,Sort employees by revenue in descending order.,employees,revenue,"df.sort_values(by='revenue', ascending=False)"
Sorting & Ranking,Display customers in order of decreasing rating.,customers,rating,"df.sort_values(by='rating', ascending=False)"
Sorting & Ranking,Sort stores by sales in descending order.,stores,sales,"df.sort_values(by='sales', ascending=False)"
Sorting & Ranking,Find top 3 customers with highest sales.,customers,sales,"df.sort_values(by='sales', ascending=False).head(3)"
Sorting & Ranking,Show departments in increasing order of expenses.,departments,expenses,"df.sort_values(by='expenses', ascending=True)"
Sorting & Ranking,Find top 3 customers with highest profit.,customers,profit,"df.sort_values(by='profit', ascending=False).head(3)"
Sorting & Ranking,Rank products by expenses.,products,expenses,df['expenses_rank'] = df['expenses'].rank(ascending=False)
Sorting & Ranking,Show stores sorted by sales ascending.,stores,sales,"df.sort_values(by='sales', ascending=True)"
Sorting & Ranking,List the lowest rating values grouped by customers.,customers,rating,"df.sort_values(by='rating', ascending=True)"
Sorting & Ranking,List the lowest expenses values grouped by employees.,employees,expenses,"df.sort_values(by='expenses', ascending=True)"
Sorting & Ranking,Sort stores by expenses in descending order.,stores,expenses,"df.sort_values(by='expenses', ascending=False)"
Sorting & Ranking,Find top 3 stores with highest sales.,stores,sales,"df.sort_values(by='sales', ascending=False).head(3)"
Sorting & Ranking,Get bottom 10 products based on sales.,products,sales,"df.sort_values(by='sales', ascending=True).head(10)"
Sorting & Ranking,Find top 2 stores with highest sales.,stores,sales,"df.sort_values(by='sales', ascending=False).head(2)"
Sorting & Ranking,Sort employees by units_sold in descending order.,employees,units_sold,"df.sort_values(by='units_sold', ascending=False)"
Sorting & Ranking,Get bottom 10 stores based on profit.,stores,profit,"df.sort_values(by='profit', ascending=True).head(10)"
Sorting & Ranking,Rank customers by profit.,customers,profit,df['profit_rank'] = df['profit'].rank(ascending=False)
Sorting & Ranking,List the lowest profit values grouped by employees.,employees,profit,"df.sort_values(by='profit', ascending=True)"
Sorting & Ranking,Sort stores by units_sold in descending order.,stores,units_sold,"df.sort_values(by='units_sold', ascending=False)"
Sorting & Ranking,Display departments in order of decreasing sales.,departments,sales,"df.sort_values(by='sales', ascending=False)"
Sorting & Ranking,Rank employees by profit.,employees,profit,df['profit_rank'] = df['profit'].rank(ascending=False)
Sorting & Ranking,Show employees in increasing order of rating.,employees,rating,"df.sort_values(by='rating', ascending=True)"
Sorting & Ranking,Sort departments by units_sold in descending order.,departments,units_sold,"df.sort_values(by='units_sold', ascending=False)"
Sorting & Ranking,Rank products by profit.,products,profit,df['profit_rank'] = df['profit'].rank(ascending=False)
Sorting & Ranking,Find top 2 employees with highest sales.,employees,sales,"df.sort_values(by='sales', ascending=False).head(2)"
Sorting & Ranking,Show products in increasing order of expenses.,products,expenses,"df.sort_values(by='expenses', ascending=True)"
Sorting & Ranking,Show customers sorted by sales ascending.,customers,sales,"df.sort_values(by='sales', ascending=True)"
Sorting & Ranking,List top 5 departments by revenue.,departments,revenue,"df.sort_values(by='revenue', ascending=False).head(5)"
Sorting & Ranking,Get bottom 10 customers based on revenue.,customers,revenue,"df.sort_values(by='revenue', ascending=True).head(10)"
Sorting & Ranking,Sort customers by revenue in descending order.,customers,revenue,"df.sort_values(by='revenue', ascending=False)"
Sorting & Ranking,List the lowest revenue values grouped by employees.,employees,revenue,"df.sort_values(by='revenue', ascending=True)"
Sorting & Ranking,Rank employees by units_sold.,employees,units_sold,df['units_sold_rank'] = df['units_sold'].rank(ascending=False)
Sorting & Ranking,List top 5 departments by revenue.,departments,revenue,"df.sort_values(by='revenue', ascending=False).head(5)"
Sorting & Ranking,Get bottom 10 customers based on rating.,customers,rating,"df.sort_values(by='rating', ascending=True).head(10)"
Sorting & Ranking,Get bottom 10 products based on expenses.,products,expenses,"df.sort_values(by='expenses', ascending=True).head(10)"
Sorting & Ranking,List top 5 employees by sales.,employees,sales,"df.sort_values(by='sales', ascending=False).head(5)"
Sorting & Ranking,10 customers with most revenue,customers,revenue,"df.sort_values(by='revenue', ascending=False).head(10)"
Sorting & Ranking,stores sorted top by profit,stores,profit,"df.sort_values(by='profit', ascending=False)"
Sorting & Ranking,show top 20 products by ratings,products,ratings,"df.sort_values(by='ratings', ascending=True).head(20)"
Sorting & Ranking,list 10 stores having low to high profit,stores,profit,"df.sort_values(by='profit', ascending=True).head(10)"
Sorting & Ranking,categories sorted least by orders,categories,orders,"df.sort_values(by='orders', ascending=True)"
Sorting & Ranking,get top 20 customers increasing revenue,customers,revenue,"df.sort_values(by='revenue', ascending=True).head(20)"
Sorting & Ranking,list 5 categories having decreasing orders,categories,orders,"df.sort_values(by='orders', ascending=False).head(5)"
Sorting & Ranking,show top 20 customers by revenue,customers,revenue,"df.sort_values(by='revenue', ascending=False).head(20)"
Sorting & Ranking,get top 10 stores bottom profit,stores,profit,"df.sort_values(by='profit', ascending=True).head(10)"
Sorting & Ranking,organize products by ratings (least),products,ratings,"df.sort_values(by='ratings', ascending=True)"
Sorting & Ranking,list 20 employees having increasing sales,employees,sales,"df.sort_values(by='sales', ascending=True).head(20)"
Sorting & Ranking,sort categories by orders in bottom order,categories,orders,"df.sort_values(by='orders', ascending=True)"
Sorting & Ranking,arrange all stores according to most profit,stores,profit,"df.sort_values(by='profit', ascending=False)"
Sorting & Ranking,get top 3 products greatest ratings,products,ratings,"df.sort_values(by='ratings', ascending=False).head(3)"
Sorting & Ranking,get top 20 customers highest revenue,customers,revenue,"df.sort_values(by='revenue', ascending=False).head(20)"
Sorting & Ranking,customers sorted most by revenue,customers,revenue,"df.sort_values(by='revenue', ascending=False)"
Sorting & Ranking,categories sorted bottom by orders,categories,orders,"df.sort_values(by='orders', ascending=True)"
Sorting & Ranking,employees sorted most by sales,employees,sales,"df.sort_values(by='sales', ascending=False)"
Sorting & Ranking,employees sorted low to high by units_sold,employees,units_sold,"df.sort_values(by='units_sold', ascending=True)"
Sorting & Ranking,show top 20 products by ratings,products,ratings,"df.sort_values(by='ratings', ascending=False).head(20)"
Sorting & Ranking,3 employees with greatest sales,employees,sales,"df.sort_values(by='sales', ascending=False).head(3)"
Sorting & Ranking,customers sorted bottom by revenue,customers,revenue,"df.sort_values(by='revenue', ascending=True)"
Sorting & Ranking,5 employees with greatest sales,employees,sales,"df.sort_values(by='sales', ascending=False).head(5)"
Sorting & Ranking,show top 5 employees by sales,employees,sales,"df.sort_values(by='sales', ascending=True).head(5)"
Sorting & Ranking,organize products by ratings (bottom),products,ratings,"df.sort_values(by='ratings', ascending=True)"
Sorting & Ranking,categories sorted ascending by orders,categories,orders,"df.sort_values(by='orders', ascending=True)"
Sorting & Ranking,categories sorted top by orders,categories,orders,"df.sort_values(by='orders', ascending=False)"
Sorting & Ranking,show top 10 employees by sales,employees,sales,"df.sort_values(by='sales', ascending=False).head(10)"
Sorting & Ranking,customers sorted descending by revenue,customers,revenue,"df.sort_values(by='revenue', ascending=False)"
Sorting & Ranking,arrange all customers according to low to high revenue,customers,revenue,"df.sort_values(by='revenue', ascending=True)"
Sorting & Ranking,get top 10 categories bottom orders,categories,orders,"df.sort_values(by='orders', ascending=True).head(10)"
Sorting & Ranking,order stores based on profit (least),stores,profit,"df.sort_values(by='profit', ascending=True)"
Sorting & Ranking,order products based on ratings (greatest),products,ratings,"df.sort_values(by='ratings', ascending=False)"
Sorting & Ranking,3 employees with least units_sold,employees,units_sold,"df.sort_values(by='units_sold', ascending=True).head(3)"
Sorting & Ranking,get top 5 employees decreasing units_sold,employees,units_sold,"df.sort_values(by='units_sold', ascending=False).head(5)"
Sorting & Ranking,organize stores by profit (bottom),stores,profit,"df.sort_values(by='profit', ascending=True)"
Sorting & Ranking,sort stores by profit in least order,stores,profit,"df.sort_values(by='profit', ascending=True)"
Sorting & Ranking,arrange all stores according to high to low profit,stores,profit,"df.sort_values(by='profit', ascending=False)"
Sorting & Ranking,organize employees by units_sold (greatest),employees,units_sold,"df.sort_values(by='units_sold', ascending=False)"
Sorting & Ranking,sort categories by orders in most order,categories,orders,"df.sort_values(by='orders', ascending=False)"
Sorting & Ranking,get top 5 employees top sales,employees,sales,"df.sort_values(by='sales', ascending=False).head(5)"
Sorting & Ranking,order products based on ratings (most),products,ratings,"df.sort_values(by='ratings', ascending=False)"
Sorting & Ranking,organize products by ratings (increasing),products,ratings,"df.sort_values(by='ratings', ascending=True)"
Sorting & Ranking,order categories based on orders (descending),categories,orders,"df.sort_values(by='orders', ascending=False)"
Sorting & Ranking,list 5 employees having least sales,employees,sales,"df.sort_values(by='sales', ascending=True).head(5)"
Sorting & Ranking,arrange all employees according to decreasing units_sold,employees,units_sold,"df.sort_values(by='units_sold', ascending=False)"
Sorting & Ranking,get top 20 employees highest sales,employees,sales,"df.sort_values(by='sales', ascending=False).head(20)"
Sorting & Ranking,display 3 stores sorted by profit (ascending),stores,profit,"df.sort_values(by='profit', ascending=True).head(3)"
Sorting & Ranking,arrange all customers according to low to high revenue,customers,revenue,"df.sort_values(by='revenue', ascending=True)"
Sorting & Ranking,employees sorted least by sales,employees,sales,"df.sort_values(by='sales', ascending=True)"
Sorting & Ranking,10 customrs with most Revenue,customers,revenue,"df.sort_values(by='revenue', ascending=False).head(10)"
Sorting & Ranking,STORES sorted top by Profitt,stores,profit,"df.sort_values(by='profit', ascending=False)"
Sorting & Ranking,show top 20 PRODUCTS by RATINGS,products,ratings,"df.sort_values(by='ratings', ascending=True).head(20)"
Sorting & Ranking,list 10 Storez having low to high PROFIT,stores,profit,"df.sort_values(by='profit', ascending=True).head(10)"
Sorting & Ranking,categores sorted least by ORDERS,categories,orders,"df.sort_values(by='orders', ascending=True)"
Sorting & Ranking,get top 20 customrs increasing REVENUE,customers,revenue,"df.sort_values(by='revenue', ascending=True).head(20)"
Sorting & Ranking,list 5 categores having decreasing odders,categories,orders,"df.sort_values(by='orders', ascending=False).head(5)"
Sorting & Ranking,show top 20 customrs by REVENUE,customers,revenue,"df.sort_values(by='revenue', ascending=False).head(20)"
Sorting & Ranking,get top 10 Storez bottom proffit,stores,profit,"df.sort_values(by='profit', ascending=True).head(10)"
Sorting & Ranking,organize productz by raatings (least),products,ratings,"df.sort_values(by='ratings', ascending=True)"
Sorting & Ranking,list 20 empoyees having increasing sails,employees,sales,"df.sort_values(by='sales', ascending=True).head(20)"
Sorting & Ranking,sort CategorieS by Orderz in bottom order,categories,orders,"df.sort_values(by='orders', ascending=True)"
Sorting & Ranking,arrange all stoers according to most PROFIT,stores,profit,"df.sort_values(by='profit', ascending=False)"
Sorting & Ranking,get top 3 PRODUCTS greatest RATINGS,products,ratings,"df.sort_values(by='ratings', ascending=False).head(3)"
Sorting & Ranking,get top 20 custmers highest Revenue,customers,revenue,"df.sort_values(by='revenue', ascending=False).head(20)"
Sorting & Ranking,CustomerS sorted most by reveneu,customers,revenue,"df.sort_values(by='revenue', ascending=False)"
Sorting & Ranking,CategorieS sorted bottom by ORDERS,categories,orders,"df.sort_values(by='orders', ascending=True)"
Sorting & Ranking,empoyees sorted most by Sells,employees,sales,"df.sort_values(by='sales', ascending=False)"
Sorting & Ranking,EMPLoyees sorted low to high by unit_sold,employees,units_sold,"df.sort_values(by='units_sold', ascending=True)"
Sorting & Ranking,show top 20 PRODUCTS by ratingz,products,ratings,"df.sort_values(by='ratings', ascending=False).head(20)"
Sorting & Ranking,3 empoyees with greatest sails,employees,sales,"df.sort_values(by='sales', ascending=False).head(3)"
Sorting & Ranking,customrs sorted bottom by Revenue,customers,revenue,"df.sort_values(by='revenue', ascending=True)"
Sorting & Ranking,5 empoyees with greatest SALES,employees,sales,"df.sort_values(by='sales', ascending=False).head(5)"
Sorting & Ranking,show top 5 EMPLoyees by SALES,employees,sales,"df.sort_values(by='sales', ascending=True).head(5)"
Sorting & Ranking,organize PRODUCTS by RATINGS (bottom),products,ratings,"df.sort_values(by='ratings', ascending=True)"
Sorting & Ranking,categores sorted ascending by odders,categories,orders,"df.sort_values(by='orders', ascending=True)"
Sorting & Ranking,categoriess sorted top by ORDERS,categories,orders,"df.sort_values(by='orders', ascending=False)"
Sorting & Ranking,show top 10 empoyees by Sells,employees,sales,"df.sort_values(by='sales', ascending=False).head(10)"
Sorting & Ranking,CustomerS sorted descending by REVENUE,customers,revenue,"df.sort_values(by='revenue', ascending=False)"
Sorting & Ranking,arrange all custmers according to low to high reveneu,customers,revenue,"df.sort_values(by='revenue', ascending=True)"
Sorting & Ranking,show top eight categories by orders,categories,orders,"df.sort_values(by='orders', ascending=True).head(8)"
Sorting & Ranking,list two stores having most profit,stores,profit,"df.sort_values(by='profit', ascending=False).head(2)"
Sorting & Ranking,show top two employees by units_sold,employees,units_sold,"df.sort_values(by='units_sold', ascending=True).head(2)"
Sorting & Ranking,three employees with bottom units_sold,employees,units_sold,"df.sort_values(by='units_sold', ascending=True).head(3)"
Sorting & Ranking,list three employees having greatest units_sold,employees,units_sold,"df.sort_values(by='units_sold', ascending=False).head(3)"
Sorting & Ranking,display five employees sorted by units_sold (increasing),employees,units_sold,"df.sort_values(by='units_sold', ascending=True).head(5)"
Sorting & Ranking,display fifty employees sorted by units_sold (increasing),employees,units_sold,"df.sort_values(by='units_sold', ascending=True).head(50)"
Sorting & Ranking,eight employees with smallest units_sold,employees,units_sold,"df.sort_values(by='units_sold', ascending=True).head(8)"
Sorting & Ranking,list four employees having least sales,employees,sales,"df.sort_values(by='sales', ascending=True).head(4)"
Sorting & Ranking,display nine categories sorted by orders (increasing),categories,orders,"df.sort_values(by='orders', ascending=True).head(9)"
Sorting & Ranking,display twenty products sorted by ratings (decreasing),products,ratings,"df.sort_values(by='ratings', ascending=False).head(20)"
Sorting & Ranking,display six employees sorted by sales (bottom),employees,sales,"df.sort_values(by='sales', ascending=True).head(6)"
Sorting & Ranking,display thirty employees sorted by units_sold (increasing),employees,units_sold,"df.sort_values(by='units_sold', ascending=True).head(30)"
Sorting & Ranking,five products with low to high ratings,products,ratings,"df.sort_values(by='ratings', ascending=True).head(5)"
Sorting & Ranking,get top seven categories most orders,categories,orders,"df.sort_values(by='orders', ascending=False).head(7)"
Sorting & Ranking,show top twenty employees by units_sold,employees,units_sold,"df.sort_values(by='units_sold', ascending=False).head(20)"
Sorting & Ranking,display fifty employees sorted by units_sold (bottom),employees,units_sold,"df.sort_values(by='units_sold', ascending=True).head(50)"
Sorting & Ranking,list seven employees having ascending sales,employees,sales,"df.sort_values(by='sales', ascending=True).head(7)"
Sorting & Ranking,get top four products least ratings,products,ratings,"df.sort_values(by='ratings', ascending=True).head(4)"
Sorting & Ranking,show top six stores by profit,stores,profit,"df.sort_values(by='profit', ascending=False).head(6)"
Sorting & Ranking,display six entries sorted by Posting Updated (highest),jobs,Posting Updated,"df.sort_values(by='Posting Updated', ascending=False).head(6)"
Sorting & Ranking,sort jobs by Title Classification in low to high order,jobs,Title Classification,"df.sort_values(by='Title Classification', ascending=True)"
Sorting & Ranking,list three jobs with highest Title Classification,jobs,Title Classification,"df.sort_values(by='Title Classification', ascending=False).head(3)"
Sorting & Ranking,arrange job entries according to highest Division/Work Unit,jobs,Division/Work Unit,"df.sort_values(by='Division/Work Unit', ascending=False)"
Sorting & Ranking,arrange job entries according to decreasing Full-Time/Part-Time indicator,jobs,Full-Time/Part-Time indicator,"df.sort_values(by='Full-Time/Part-Time indicator', ascending=False)"
Sorting & Ranking,display nine entries sorted by Residency Requirement (highest),jobs,Residency Requirement,"df.sort_values(by='Residency Requirement', ascending=False).head(9)"
Sorting & Ranking,display five entries sorted by Posting Date (low to high),jobs,Posting Date,"df.sort_values(by='Posting Date', ascending=True).head(5)"
Sorting & Ranking,organize postings by Post Until descending,jobs,Post Until,"df.sort_values(by='Post Until', ascending=False)"
Sorting & Ranking,sort jobs by Post Until in top order,jobs,Post Until,"df.sort_values(by='Post Until', ascending=False)"
Sorting & Ranking,organize postings by Salary Range To increasing,jobs,Salary Range To,"df.sort_values(by='Salary Range To', ascending=True)"
Sorting & Ranking,display two entries sorted by Division/Work Unit (least),jobs,Division/Work Unit,"df.sort_values(by='Division/Work Unit', ascending=True).head(2)"
Sorting & Ranking,display eight entries sorted by Posting Date (smallest),jobs,Posting Date,"df.sort_values(by='Posting Date', ascending=True).head(8)"
Sorting & Ranking,list seven jobs with bottom Salary Range From,jobs,Salary Range From,"df.sort_values(by='Salary Range From', ascending=True).head(7)"
Sorting & Ranking,display seven entries sorted by Posting Updated (descending),jobs,Posting Updated,"df.sort_values(by='Posting Updated', ascending=False).head(7)"
Sorting & Ranking,thirty job postings with top Preferred Skills,jobs,Preferred Skills,"df.sort_values(by='Preferred Skills', ascending=False).head(30)"
Sorting & Ranking,four job postings with increasing Salary Range From,jobs,Salary Range From,"df.sort_values(by='Salary Range From', ascending=True).head(4)"
Sorting & Ranking,organize postings by Recruitment Contact least,jobs,Recruitment Contact,"df.sort_values(by='Recruitment Contact', ascending=True)"
Sorting & Ranking,list four jobs with high to low Work Location 1,jobs,Work Location 1,"df.sort_values(by='Work Location 1', ascending=False).head(4)"
Sorting & Ranking,sort jobs by Salary Range From in highest order,jobs,Salary Range From,"df.sort_values(by='Salary Range From', ascending=False)"
Sorting & Ranking,list two jobs with most Minimum Qual Requirements,jobs,Minimum Qual Requirements,"df.sort_values(by='Minimum Qual Requirements', ascending=False).head(2)"
Sorting & Ranking,nine job postings with increasing Job Category,jobs,Job Category,"df.sort_values(by='Job Category', ascending=True).head(9)"
Sorting & Ranking,sort jobs by To Apply in bottom order,jobs,To Apply,"df.sort_values(by='To Apply', ascending=True)"
Sorting & Ranking,forty job postings with ascending Recruitment Contact,jobs,Recruitment Contact,"df.sort_values(by='Recruitment Contact', ascending=True).head(40)"
Sorting & Ranking,display seven entries sorted by Title Classification (greatest),jobs,Title Classification,"df.sort_values(by='Title Classification', ascending=False).head(7)"
Sorting & Ranking,organize postings by Title Code No most,jobs,Title Code No,"df.sort_values(by='Title Code No', ascending=False)"
Sorting & Ranking,show top two jobs by Civil Service Title,jobs,Civil Service Title,"df.sort_values(by='Civil Service Title', ascending=False).head(2)"
Sorting & Ranking,organize postings by Posting Date descending,jobs,Posting Date,"df.sort_values(by='Posting Date', ascending=False)"
Sorting & Ranking,list ten jobs with top Full-Time/Part-Time indicator,jobs,Full-Time/Part-Time indicator,"df.sort_values(by='Full-Time/Part-Time indicator', ascending=False).head(10)"
Sorting & Ranking,display four entries sorted by Residency Requirement (descending),jobs,Residency Requirement,"df.sort_values(by='Residency Requirement', ascending=False).head(4)"
Sorting & Ranking,show top six jobs by Preferred Skills,jobs,Preferred Skills,"df.sort_values(by='Preferred Skills', ascending=True).head(6)"
