query_type,query,df_command,col_1,col_2
Text/String Operations,list records where job_title has '.COM' or email has 'pro',"df[df['job_title'].str.contains('.COM', case=False, na=False) | df['email'].str.contains('pro', case=False, na=False)]",job_title,
Text/String Operations,list entries where Salary Range To has 'inc' in it,"df[df['Salary Range To'].str.contains('inc', case=False, na=False)]",Salary Range To,
Text/String Operations,show rows where Civil Service Title finishes with salez,"df[df['Civil Service Title'].str.endswith('sales', na=False)]",Civil Service Title,
Text/String Operations,show records where Level begins with INC,"df[df['Level'].str.startswith('inc', na=False)]",Level,
Text/String Operations,show records where Additional Information begins with sells,"df[df['Additional Information'].str.startswith('sales', na=False)]",Additional Information,
Text/String Operations,Salary Range To contains value sales,"df[df['Salary Range To'].str.contains('sales', case=False, na=False)]",Salary Range To,
Text/String Operations,find all where Job Description contains 'hire',"df[df['Job Description'].str.contains('hiring', case=False, na=False)]",Job Description,
Text/String Operations,list entries where Salary Range From has '.com' in it,"df[df['Salary Range From'].str.contains('.com', case=False, na=False)]",Salary Range From,
Text/String Operations,find all where Civil Service Title contains 'Tech',"df[df['Civil Service Title'].str.contains('tech', case=False, na=False)]",Civil Service Title,
Text/String Operations,show records where Work Location 1 begins with ink,"df[df['Work Location 1'].str.startswith('inc', na=False)]",Work Location 1,
Text/String Operations,Level starts with 'support',"df[df['Level'].str.startswith('support', na=False)]",Level,
Text/String Operations,Posting Updated ends with 'Support',"df[df['Posting Updated'].str.endswith('support', na=False)]",Posting Updated,
Text/String Operations,Additional Information starts with 'managr',"df[df['Additional Information'].str.startswith('manager', na=False)]",Additional Information,
Text/String Operations,show records where Residency Requirement begins with sup,"df[df['Residency Requirement'].str.startswith('support', na=False)]",Residency Requirement,
Text/String Operations,show records where Residency Requirement begins with sells,"df[df['Residency Requirement'].str.startswith('sales', na=False)]",Residency Requirement,
Text/String Operations,Additional Information ends with 'Sales',"df[df['Additional Information'].str.endswith('sales', na=False)]",Additional Information,
Text/String Operations,Additional Information includes 'Pro',"df[df['Additional Information'].str.contains('pro', case=False, na=False)]",Additional Information,
Text/String Operations,list entries where Hours/Shift has 'pr0' in it,"df[df['Hours/Shift'].str.contains('pro', case=False, na=False)]",Hours/Shift,
Text/String Operations,show records where Level begins with Manager,"df[df['Level'].str.startswith('manager', na=False)]",Level,
Text/String Operations,show rows where Posting Date finishes with pro,"df[df['Posting Date'].str.endswith('pro', na=False)]",Posting Date,
Text/String Operations,Minimum Qual Requirements includes 'INC',"df[df['Minimum Qual Requirements'].str.contains('inc', case=False, na=False)]",Minimum Qual Requirements,
Text/String Operations,Career Level includes 'pr0',"df[df['Career Level'].str.contains('pro', case=False, na=False)]",Career Level,
Text/String Operations,Process Date starts with 'Tech',"df[df['Process Date'].str.startswith('tech', na=False)]",Process Date,
Text/String Operations,Hours/Shift ends with 'dotcom',"df[df['Hours/Shift'].str.endswith('.com', na=False)]",Hours/Shift,
Text/String Operations,show records where Level begins with Pro,"df[df['Level'].str.startswith('pro', na=False)]",Level,
Text/String Operations,Process Date ends with 'Hiring',"df[df['Process Date'].str.endswith('hiring', na=False)]",Process Date,
Text/String Operations,show rows where Career Level finishes with inc.,"df[df['Career Level'].str.endswith('inc', na=False)]",Career Level,
Text/String Operations,find all where Minimum Qual Requirements contains 'TECH',"df[df['Minimum Qual Requirements'].str.contains('tech', case=False, na=False)]",Minimum Qual Requirements,
Text/String Operations,Full-Time/Part-Time indicator starts with 'ink',"df[df['Full-Time/Part-Time indicator'].str.startswith('inc', na=False)]",Full-Time/Part-Time indicator,
Text/String Operations,Job Description starts with 'dotcom',"df[df['Job Description'].str.startswith('.com', na=False)]",Job Description,
Text/String Operations,Post Until ends with 'sales',"df[df['Post Until'].str.endswith('sales', na=False)]",Post Until,
Text/String Operations,Title Classification starts with 'managr',"df[df['Title Classification'].str.startswith('manager', na=False)]",Title Classification,
Text/String Operations,show rows where Post Until finishes with Support,"df[df['Post Until'].str.endswith('support', na=False)]",Post Until,
Text/String Operations,Hours/Shift ends with 'hiringg',"df[df['Hours/Shift'].str.endswith('hiring', na=False)]",Hours/Shift,
Text/String Operations,Level contains value pro,"df[df['Level'].str.contains('pro', case=False, na=False)]",Level,
Text/String Operations,Salary Frequency ends with '.COM',"df[df['Salary Frequency'].str.endswith('.com', na=False)]",Salary Frequency,
Text/String Operations,Title Classification includes 'inc.',"df[df['Title Classification'].str.contains('inc', case=False, na=False)]",Title Classification,
Text/String Operations,Work Location 1 ends with 'hiring',"df[df['Work Location 1'].str.endswith('hiring', na=False)]",Work Location 1,
Text/String Operations,Level ends with 'Tech',"df[df['Level'].str.endswith('tech', na=False)]",Level,
Text/String Operations,Division/Work Unit starts with 'sells',"df[df['Division/Work Unit'].str.startswith('sales', na=False)]",Division/Work Unit,
Text/String Operations,Posting Updated ends with 'TECH',"df[df['Posting Updated'].str.endswith('tech', na=False)]",Posting Updated,
Text/String Operations,find company_name ending in Sales,"df[df['company_name'].str.endswith('sales', na=False)]",company_name,
Text/String Operations,find email ending in salez,"df[df['email'].str.endswith('sales', na=False)]",email,
Text/String Operations,department has 'managr' in it,"df[df['department'].str.contains('manager', case=False, na=False)]",department,
Text/String Operations,product_name has word salez,"df[df['product_name'].str.contains('sales', case=False, na=False)]",product_name,
Text/String Operations,city has 'Manager' in it,"df[df['city'].str.contains('manager', case=False, na=False)]",city,
Text/String Operations,get records with product_name beginning as Tech,"df[df['product_name'].str.startswith('tech', na=False)]",product_name,
Text/String Operations,get values with product_name trailing with dotcom,"df[df['product_name'].str.endswith('.com', na=False)]",product_name,
Text/String Operations,find rows where email includes 'Manager',"df[df['email'].str.contains('manager', case=False, na=False)]",email,
Text/String Operations,email has word mngr,"df[df['email'].str.contains('manager', case=False, na=False)]",email,
Text/String Operations,get records with job_title beginning as mngr,"df[df['job_title'].str.startswith('manager', na=False)]",job_title,
Text/String Operations,show rows where city starts with dotcom,"df[df['city'].str.startswith('.com', na=False)]",city,
Text/String Operations,product_name field holds value support,"df[df['product_name'].str.contains('support', case=False, na=False)]",product_name,
Text/String Operations,city has word hiringg,"df[df['city'].str.contains('hiring', case=False, na=False)]",city,
Text/String Operations,find email ending in dotcom,"df[df['email'].str.endswith('.com', na=False)]",email,
Text/String Operations,get values with product_name trailing with Pro,"df[df['product_name'].str.endswith('pro', na=False)]",product_name,
Text/String Operations,get values with job_title trailing with inc.,"df[df['job_title'].str.endswith('inc', na=False)]",job_title,
Text/String Operations,find rows where email includes 'manager',"df[df['email'].str.contains('manager', case=False, na=False)]",email,
Text/String Operations,get records with job_title beginning as pro,"df[df['job_title'].str.startswith('pro', na=False)]",job_title,
Text/String Operations,find product_name ending in Manager,"df[df['product_name'].str.endswith('manager', na=False)]",product_name,
Text/String Operations,find department ending in support,"df[df['department'].str.endswith('support', na=False)]",department,
Text/String Operations,list where department ends with INC,"df[df['department'].str.endswith('inc', na=False)]",department,
Text/String Operations,show rows where city starts with sup,"df[df['city'].str.startswith('support', na=False)]",city,
Text/String Operations,job_title has word managr,"df[df['job_title'].str.contains('manager', case=False, na=False)]",job_title,
Text/String Operations,list where city ends with hiringg,"df[df['city'].str.endswith('hiring', na=False)]",city,
Text/String Operations,department field begins with dotcom,"df[df['department'].str.startswith('.com', na=False)]",department,
Text/String Operations,find city ending in Manager,"df[df['city'].str.endswith('manager', na=False)]",city,
Text/String Operations,job_title field begins with Pro,"df[df['job_title'].str.startswith('pro', na=False)]",job_title,
Text/String Operations,find department ending in managr,"df[df['department'].str.endswith('manager', na=False)]",department,
Text/String Operations,get values with email trailing with manager,"df[df['email'].str.endswith('manager', na=False)]",email,
Text/String Operations,list where company_name ends with .COM,"df[df['company_name'].str.endswith('.com', na=False)]",company_name,
Text/String Operations,find rows where city includes 'Sales',"df[df['city'].str.contains('sales', case=False, na=False)]",city,
Text/String Operations,find city ending in support,"df[df['city'].str.endswith('support', na=False)]",city,
Text/String Operations,list where department ends with Hiring,"df[df['department'].str.endswith('hiring', na=False)]",department,
Text/String Operations,show all department with tech in it,"df[df['department'].str.contains('tech', case=False, na=False)]",department,
Text/String Operations,find rows where product_name includes 'TECH',"df[df['product_name'].str.contains('tech', case=False, na=False)]",product_name,
Text/String Operations,job_title has 'mngr' in it,"df[df['job_title'].str.contains('manager', case=False, na=False)]",job_title,
Text/String Operations,product_name has word INC,"df[df['product_name'].str.contains('inc', case=False, na=False)]",product_name,
Text/String Operations,show rows where email starts with sales,"df[df['email'].str.startswith('sales', na=False)]",email,
Text/String Operations,get records with product_name beginning as TECH,"df[df['product_name'].str.startswith('tech', na=False)]",product_name,
Text/String Operations,find department ending in Manager,"df[df['department'].str.endswith('manager', na=False)]",department,
Text/String Operations,get records with email beginning as Support,"df[df['email'].str.startswith('support', na=False)]",email,
Text/String Operations,job_title has 'hire' in it,"df[df['job_title'].str.contains('hiring', case=False, na=False)]",job_title,
Text/String Operations,company_name field holds value Sales,"df[df['company_name'].str.contains('sales', case=False, na=False)]",company_name,
Text/String Operations,show rows where department starts with pro,"df[df['department'].str.startswith('pro', na=False)]",department,
Text/String Operations,department has word inc.,"df[df['department'].str.contains('inc', case=False, na=False)]",department,
Text/String Operations,show rows where email starts with INC,"df[df['email'].str.startswith('inc', na=False)]",email,
Text/String Operations,get values with product_name trailing with dotcom,"df[df['product_name'].str.endswith('.com', na=False)]",product_name,
Text/String Operations,find product_name ending in Support,"df[df['product_name'].str.endswith('support', na=False)]",product_name,
Text/String Operations,product_name field begins with TECH,"df[df['product_name'].str.startswith('tech', na=False)]",product_name,
Text/String Operations,get entries if department contains .com,"df[df['department'].str.contains('.com', case=False, na=False)]",department,
Text/String Operations,get rows where product_name does not contain 'suport',"df[~df['product_name'].str.contains('suport', case=False, na=False)]",product_name,
Text/String Operations,get rows where company_name does not contain '.COM',"df[~df['company_name'].str.contains('.COM', case=False, na=False)]",company_name,
Text/String Operations,find email having 'tech' and company_name with 'hiringg',"df[df['email'].str.contains('tech', case=False, na=False) & df['company_name'].str.contains('hiringg', case=False, na=False)]",email,company_name
Text/String Operations,get rows where product_name does not contain 'tek',"df[~df['product_name'].str.contains('tek', case=False, na=False)]",product_name,
Text/String Operations,find department having 'support' and job_title with 'inc.',"df[df['department'].str.contains('support', case=False, na=False) & df['job_title'].str.contains('inc.', case=False, na=False)]",department,job_title
Text/String Operations,get rows where company_name does not contain 'hiring',"df[~df['company_name'].str.contains('hiring', case=False, na=False)]",company_name,
Text/String Operations,find company_name having 'salez' and product_name with 'managr',"df[df['company_name'].str.contains('salez', case=False, na=False) & df['product_name'].str.contains('managr', case=False, na=False)]",company_name,product_name
Text/String Operations,find department having 'salez' and email with 'sales',"df[df['department'].str.contains('salez', case=False, na=False) & df['email'].str.contains('sales', case=False, na=False)]",department,email
Text/String Operations,get rows where product_name does not contain 'Sales',"df[~df['product_name'].str.contains('Sales', case=False, na=False)]",product_name,
Text/String Operations,get rows where email does not contain 'support',"df[~df['email'].str.contains('support', case=False, na=False)]",email,
Text/String Operations,list records where department has 'dotcom' or company_name has 'dotcom',"df[df['department'].str.contains('dotcom', case=False, na=False) | df['company_name'].str.contains('dotcom', case=False, na=False)]",department,company_name
Text/String Operations,get rows where department does not contain 'inc.',"df[~df['department'].str.contains('inc.', case=False, na=False)]",department,
Text/String Operations,find job_title having 'managr' and city with '.com',"df[df['job_title'].str.contains('managr', case=False, na=False) & df['city'].str.contains('.com', case=False, na=False)]",job_title,city
Text/String Operations,get rows where department does not contain 'tek',"df[~df['department'].str.contains('tek', case=False, na=False)]",department,
Text/String Operations,get rows where department does not contain 'hiring',"df[~df['department'].str.contains('hiring', case=False, na=False)]",department,
Text/String Operations,get rows where product_name does not contain 'PRo',"df[~df['product_name'].str.contains('PRo', case=False, na=False)]",product_name,
Text/String Operations,find city having 'dotcom' and product_name with 'pr0',"df[df['city'].str.contains('dotcom', case=False, na=False) & df['product_name'].str.contains('pr0', case=False, na=False)]",city,product_name
Text/String Operations,list records where product_name has 'Tech' or job_title has 'PRo',"df[df['product_name'].str.contains('Tech', case=False, na=False) | df['job_title'].str.contains('PRo', case=False, na=False)]",product_name,job_title
Text/String Operations,list records where department has '.com' or job_title has 'hiring',"df[df['department'].str.contains('.com', case=False, na=False) | df['job_title'].str.contains('hiring', case=False, na=False)]",department,job_title
Text/String Operations,list records where job_title has 'sup' or product_name has '.com',"df[df['job_title'].str.contains('sup', case=False, na=False) | df['product_name'].str.contains('.com', case=False, na=False)]",job_title,product_name
Text/String Operations,list records where product_name has 'support' or job_title has 'Sales',"df[df['product_name'].str.contains('support', case=False, na=False) | df['job_title'].str.contains('Sales', case=False, na=False)]",product_name,job_title
Text/String Operations,find email having 'salez' and job_title with 'dotcom',"df[df['email'].str.contains('salez', case=False, na=False) & df['job_title'].str.contains('dotcom', case=False, na=False)]",email,job_title
Text/String Operations,find job_title having 'mngr' and company_name with 'hiringg',"df[df['job_title'].str.contains('mngr', case=False, na=False) & df['company_name'].str.contains('hiringg', case=False, na=False)]",job_title,company_name
Text/String Operations,list records where job_title has 'sales' or product_name has 'ink',"df[df['job_title'].str.contains('sales', case=False, na=False) | df['product_name'].str.contains('ink', case=False, na=False)]",job_title,product_name
Text/String Operations,list records where job_title has '.COM' or email has 'pro',"df[df['job_title'].str.contains('.COM', case=False, na=False) | df['email'].str.contains('pro', case=False, na=False)]",job_title,email
Text/String Operations,list entries where Salary Range To has 'inc' in it,"df[df['Salary Range To'].str.contains('inc', case=False, na=False)]",Salary Range To,
Text/String Operations,show rows where Civil Service Title finishes with salez,"df[df['Civil Service Title'].str.endswith('sales', na=False)]",Civil Service Title,
Text/String Operations,show records where Level begins with INC,"df[df['Level'].str.startswith('inc', na=False)]",Level,
Text/String Operations,show records where Additional Information begins with sells,"df[df['Additional Information'].str.startswith('sales', na=False)]",Additional Information,
Text/String Operations,Salary Range To contains value sales,"df[df['Salary Range To'].str.contains('sales', case=False, na=False)]",Salary Range To,
Text/String Operations,find all where Job Description contains 'hire',"df[df['Job Description'].str.contains('hiring', case=False, na=False)]",Job Description,
Text/String Operations,list entries where Salary Range From has '.com' in it,"df[df['Salary Range From'].str.contains('.com', case=False, na=False)]",Salary Range From,
Text/String Operations,find all where Civil Service Title contains 'Tech',"df[df['Civil Service Title'].str.contains('tech', case=False, na=False)]",Civil Service Title,
Text/String Operations,show records where Work Location 1 begins with ink,"df[df['Work Location 1'].str.startswith('inc', na=False)]",Work Location 1,
Text/String Operations,Level starts with 'support',"df[df['Level'].str.startswith('support', na=False)]",Level,
Text/String Operations,Posting Updated ends with 'Support',"df[df['Posting Updated'].str.endswith('support', na=False)]",Posting Updated,
Text/String Operations,Additional Information starts with 'managr',"df[df['Additional Information'].str.startswith('manager', na=False)]",Additional Information,
Text/String Operations,show records where Residency Requirement begins with sup,"df[df['Residency Requirement'].str.startswith('support', na=False)]",Residency Requirement,
Text/String Operations,show records where Residency Requirement begins with sells,"df[df['Residency Requirement'].str.startswith('sales', na=False)]",Residency Requirement,
Text/String Operations,Additional Information ends with 'Sales',"df[df['Additional Information'].str.endswith('sales', na=False)]",Additional Information,
Text/String Operations,Additional Information includes 'Pro',"df[df['Additional Information'].str.contains('pro', case=False, na=False)]",Additional Information,
Text/String Operations,list entries where Hours/Shift has 'pr0' in it,"df[df['Hours/Shift'].str.contains('pro', case=False, na=False)]",Hours/Shift,
Text/String Operations,show records where Level begins with Manager,"df[df['Level'].str.startswith('manager', na=False)]",Level,
Text/String Operations,show rows where Posting Date finishes with pro,"df[df['Posting Date'].str.endswith('pro', na=False)]",Posting Date,
Text/String Operations,Minimum Qual Requirements includes 'INC',"df[df['Minimum Qual Requirements'].str.contains('inc', case=False, na=False)]",Minimum Qual Requirements,
Text/String Operations,Career Level includes 'pr0',"df[df['Career Level'].str.contains('pro', case=False, na=False)]",Career Level,
Text/String Operations,Process Date starts with 'Tech',"df[df['Process Date'].str.startswith('tech', na=False)]",Process Date,
Text/String Operations,Hours/Shift ends with 'dotcom',"df[df['Hours/Shift'].str.endswith('.com', na=False)]",Hours/Shift,
Text/String Operations,show records where Level begins with Pro,"df[df['Level'].str.startswith('pro', na=False)]",Level,
Text/String Operations,Process Date ends with 'Hiring',"df[df['Process Date'].str.endswith('hiring', na=False)]",Process Date,
Text/String Operations,show rows where Career Level finishes with inc.,"df[df['Career Level'].str.endswith('inc', na=False)]",Career Level,
Text/String Operations,find all where Minimum Qual Requirements contains 'TECH',"df[df['Minimum Qual Requirements'].str.contains('tech', case=False, na=False)]",Minimum Qual Requirements,
Text/String Operations,Full-Time/Part-Time indicator starts with 'ink',"df[df['Full-Time/Part-Time indicator'].str.startswith('inc', na=False)]",Full-Time/Part-Time indicator,
Text/String Operations,Job Description starts with 'dotcom',"df[df['Job Description'].str.startswith('.com', na=False)]",Job Description,
Text/String Operations,Post Until ends with 'sales',"df[df['Post Until'].str.endswith('sales', na=False)]",Post Until,
Text/String Operations,Title Classification starts with 'managr',"df[df['Title Classification'].str.startswith('manager', na=False)]",Title Classification,
Text/String Operations,show rows where Post Until finishes with Support,"df[df['Post Until'].str.endswith('support', na=False)]",Post Until,
Text/String Operations,Hours/Shift ends with 'hiringg',"df[df['Hours/Shift'].str.endswith('hiring', na=False)]",Hours/Shift,
Text/String Operations,Level contains value pro,"df[df['Level'].str.contains('pro', case=False, na=False)]",Level,
Text/String Operations,Salary Frequency ends with '.COM',"df[df['Salary Frequency'].str.endswith('.com', na=False)]",Salary Frequency,
Text/String Operations,Title Classification includes 'inc.',"df[df['Title Classification'].str.contains('inc', case=False, na=False)]",Title Classification,
Text/String Operations,Work Location 1 ends with 'hiring',"df[df['Work Location 1'].str.endswith('hiring', na=False)]",Work Location 1,
Text/String Operations,Level ends with 'Tech',"df[df['Level'].str.endswith('tech', na=False)]",Level,
Text/String Operations,Division/Work Unit starts with 'sells',"df[df['Division/Work Unit'].str.startswith('sales', na=False)]",Division/Work Unit,
Text/String Operations,Posting Updated ends with 'TECH',"df[df['Posting Updated'].str.endswith('tech', na=False)]",Posting Updated,
Text/String Operations,list all jobs with Salary Range From minimum 50000,df[df['Salary Range From'] >= 50000],Salary Range From,
Text/String Operations,Level != 100000,df[df['Level'] != 100000],Level,
Text/String Operations,Salary Range To should be below 30000,df[df['Salary Range To'] < 30000],Salary Range To,
Text/String Operations,Salary Range From should be maximum 200000,df[df['Salary Range From'] <= 200000],Salary Range From,
Text/String Operations,show records where Salary Range From is below 75000,df[df['Salary Range From'] < 75000],Salary Range From,
Text/String Operations,list all jobs with Salary Range To maximum 75000,df[df['Salary Range To'] <= 75000],Salary Range To,
Text/String Operations,get jobs where Level is greater than 150000,df[df['Level'] > 150000],Level,
Text/String Operations,show records where Level is >= 50000,df[df['Level'] >= 50000],Level,
Text/String Operations,Salary Range To should be maximum 150000,df[df['Salary Range To'] <= 150000],Salary Range To,
Text/String Operations,show records where Level is more than 30000,df[df['Level'] > 30000],Level,
Text/String Operations,get jobs where Level is != 50000,df[df['Level'] != 50000],Level,
Text/String Operations,Salary Range From should be == 75000,df[df['Salary Range From'] == 75000],Salary Range From,
Text/String Operations,show records where Level is maximum 75000,df[df['Level'] <= 75000],Level,
Text/String Operations,get jobs where Level is more than 30000,df[df['Level'] > 30000],Level,
Text/String Operations,Level <= 30000,df[df['Level'] <= 30000],Level,
Text/String Operations,list all jobs with Level not 200000,df[df['Level'] != 200000],Level,
Text/String Operations,get jobs where Salary Range From is under 100000,df[df['Salary Range From'] < 100000],Salary Range From,
Text/String Operations,Salary Range From should be under 75000,df[df['Salary Range From'] < 75000],Salary Range From,
Text/String Operations,list all jobs with Level equal to 100000,df[df['Level'] == 100000],Level,
Text/String Operations,Salary Range To should be not 30000,df[df['Salary Range To'] != 30000],Salary Range To,
Text/String Operations,show records where Level is more than 50000,df[df['Level'] > 50000],Level,
Text/String Operations,Salary Range To != 50000,df[df['Salary Range To'] != 50000],Salary Range To,
Text/String Operations,Salary Range From <= 75000,df[df['Salary Range From'] <= 75000],Salary Range From,
Text/String Operations,get jobs where Salary Range From is maximum 75000,df[df['Salary Range From'] <= 75000],Salary Range From,
