query_type,query,df_command,col_1,col_2
Text/String Operations,get jobs where Level is >= 200000,df[df['Level'] >= 200000],Level,
Text/String Operations,Level minimum 50000,df[df['Level'] >= 50000],Level,
Text/String Operations,Salary Range To should be != 200000,df[df['Salary Range To'] != 200000],Salary Range To,
Text/String Operations,Salary Range To less than 200000,df[df['Salary Range To'] < 200000],Salary Range To,
Text/String Operations,show records where Salary Range To is under 30000,df[df['Salary Range To'] < 30000],Salary Range To,
Text/String Operations,show records where Level is at most 200000,df[df['Level'] <= 200000],Level,
Text/String Operations,get jobs where Salary Range To is <= 100000,df[df['Salary Range To'] <= 100000],Salary Range To,
Text/String Operations,list all jobs with Salary Range To maximum 150000,df[df['Salary Range To'] <= 150000],Salary Range To,
Text/String Operations,Salary Range From should be above 100000,df[df['Salary Range From'] > 100000],Salary Range From,
Text/String Operations,show records where Salary Range To is at most 30000,df[df['Salary Range To'] <= 30000],Salary Range To,
Text/String Operations,list all jobs with Level less than 30000,df[df['Level'] < 30000],Level,
Text/String Operations,show records where Salary Range From is equal to 30000,df[df['Salary Range From'] == 30000],Salary Range From,
Text/String Operations,get jobs where Salary Range From is minimum 50000,df[df['Salary Range From'] >= 50000],Salary Range From,
Text/String Operations,show records where Salary Range From is not 200000,df[df['Salary Range From'] != 200000],Salary Range From,
Text/String Operations,get jobs where Level is at most 100000,df[df['Level'] <= 100000],Level,
Text/String Operations,list all jobs with Salary Range From above 75000,df[df['Salary Range From'] > 75000],Salary Range From,
Text/String Operations,Salary Range From should be != 200000,df[df['Salary Range From'] != 200000],Salary Range From,
Text/String Operations,list all jobs with Level is 150000,df[df['Level'] == 150000],Level,
Text/String Operations,show records where Salary Range To is greater than 200000,df[df['Salary Range To'] > 200000],Salary Range To,
Text/String Operations,show records where Salary Range To is not equal to 150000,df[df['Salary Range To'] != 150000],Salary Range To,
Text/String Operations,list all jobs with Salary Range From >= 100000,df[df['Salary Range From'] >= 100000],Salary Range From,
Text/String Operations,list all jobs with Level not 75000,df[df['Level'] != 75000],Level,
Text/String Operations,show records where Level is greater than 200000,df[df['Level'] > 200000],Level,
Text/String Operations,Salary Range From maximum 100000,df[df['Salary Range From'] <= 100000],Salary Range From,
Text/String Operations,Salary Range To should be at least 75000,df[df['Salary Range To'] >= 75000],Salary Range To,
Text/String Operations,Salary Range To != 50000,df[df['Salary Range To'] != 50000],Salary Range To,
Text/String Operations,show records where Posting Date is not equal to 200000,df[pd.to_datetime(df['Posting Date']) != pd.to_datetime('200000')],Posting Date,
Text/String Operations,show entries having Sales >= 25000,df[df['Sales'] >= 25000],Sales,
Text/String Operations,show entries having discount is 150000,df[df['discount'] == 150000],discount,
Text/String Operations,units_sold <= 30000,df[df['units_sold'] <= 30000],units_sold,
Text/String Operations,revenue should be more than 30000,df[df['revenue'] > 30000],revenue,
Text/String Operations,show entries having discount below 200000,df[df['discount'] < 200000],discount,
Text/String Operations,Salary Range To >= 200000,df[df['Salary Range To'] >= 200000],Salary Range To,
Text/String Operations,Posting Date should be minimum 100000,df[pd.to_datetime(df['Posting Date']) >= pd.to_datetime('100000')],Posting Date,
Text/String Operations,units_sold should be >= 25000,df[df['units_sold'] >= 25000],units_sold,
Text/String Operations,Salary Range To not 150000,df[df['Salary Range To'] != 150000],Salary Range To,
Text/String Operations,revenue equal to 25000,df[df['revenue'] == 25000],revenue,
Text/String Operations,show entries having revenue not 99999,df[df['revenue'] != 99999],revenue,
Text/String Operations,get records where revenue is greater than 50000,df[df['revenue'] > 50000],revenue,
Text/String Operations,Salary Range To less than 30000,df[df['Salary Range To'] < 30000],Salary Range To,
Text/String Operations,Salary Range From under 25000,df[df['Salary Range From'] < 25000],Salary Range From,
Text/String Operations,Process Date should be <= 99999,df[pd.to_datetime(df['Process Date']) <= pd.to_datetime('99999')],Process Date,
Text/String Operations,show entries having Salary Range From equal to 1,df[df['Salary Range From'] == 1],Salary Range From,
Text/String Operations,revenue should be equal to 30000,df[df['revenue'] == 30000],revenue,
Text/String Operations,entries where Posting Updated is at most 25000,df[pd.to_datetime(df['Posting Updated']) <= pd.to_datetime('25000')],Posting Updated,
Text/String Operations,get records where Sales is greater than 100000,df[df['Sales'] > 100000],Sales,
Text/String Operations,get records where revenue is more than 100000,df[df['revenue'] > 100000],revenue,
Text/String Operations,list data with Posting Updated less than 10,df[pd.to_datetime(df['Posting Updated']) < pd.to_datetime('10')],Posting Updated,
Text/String Operations,list data with Posting Updated under 0,df[pd.to_datetime(df['Posting Updated']) < pd.to_datetime('0')],Posting Updated,
Text/String Operations,show records where Posting Updated is below 10,df[pd.to_datetime(df['Posting Updated']) < pd.to_datetime('10')],Posting Updated,
Text/String Operations,Post Until should be not 200000,df[pd.to_datetime(df['Post Until']) != pd.to_datetime('200000')],Post Until,
Text/String Operations,show records where Process Date is >= 150000,df[pd.to_datetime(df['Process Date']) >= pd.to_datetime('150000')],Process Date,
Text/String Operations,Sales below 10,df[df['Sales'] < 10],Sales,
Text/String Operations,Salary Range From greater than 200000,df[df['Salary Range From'] > 200000],Salary Range From,
Text/String Operations,get records where Salary Range From is == 25000,df[df['Salary Range From'] == 25000],Salary Range From,
Text/String Operations,units_sold should be is 30000,df[df['units_sold'] == 30000],units_sold,
Text/String Operations,Process Date should be greater than 30000,df[pd.to_datetime(df['Process Date']) > pd.to_datetime('30000')],Process Date,
Text/String Operations,show entries having discount at most 30000,df[df['discount'] <= 30000],discount,
Text/String Operations,show entries having units_sold at most 150000,df[df['units_sold'] <= 150000],units_sold,
Text/String Operations,Process Date should be under 9999,df[pd.to_datetime(df['Process Date']) < pd.to_datetime('9999')],Process Date,
Text/String Operations,show entries having discount at least 25000,df[df['discount'] >= 25000],discount,
Text/String Operations,Sales should be is 99999,df[df['Sales'] == 99999],Sales,
Text/String Operations,get records where revenue is at most 50000,df[df['revenue'] <= 50000],revenue,
Text/String Operations,revenue should be != 0,df[df['revenue'] != 0],revenue,
Text/String Operations,Sales should be below 9999,df[df['Sales'] < 9999],Sales,
Text/String Operations,get records where Sales is is 150000,df[df['Sales'] == 150000],Sales,