query_type,query,df_command,col_1,col_2
Text/String Operations,Get rows where email field has the substring 'Manager'.,"df[df['email'].str.contains('Manager', case=False, na=False)]",email,
Text/String Operations,Find all values in city that end with 'com'.,"df[df['city'].str.endswith('com', na=False)]",city,
Text/String Operations,List all records where product_name includes 'tech'.,"df[df['product_name'].str.contains('tech', case=False, na=False)]",product_name,
Text/String Operations,Get rows where customer_name field has the substring 'Service'.,"df[df['customer_name'].str.contains('Service', case=False, na=False)]",customer_name,
Text/String Operations,Find all values in category that end with 'Manager'.,"df[df['category'].str.endswith('Manager', na=False)]",category,
Text/String Operations,Filter rows where product_name contains 'Service' substring.,"df[df['product_name'].str.contains('Service', case=False, na=False)]",product_name,
Text/String Operations,Filter rows where customer_name contains 'Service' substring.,"df[df['customer_name'].str.contains('Service', case=False, na=False)]",customer_name,
Text/String Operations,List all records where city includes 'tech'.,"df[df['city'].str.contains('tech', case=False, na=False)]",city,
Text/String Operations,Filter rows where city contains 'Store' substring.,"df[df['city'].str.contains('Store', case=False, na=False)]",city,
Text/String Operations,Find category values that contain 'Pro' case-insensitively.,"df[df['category'].str.contains('Pro', case=False, na=False)]",category,
Text/String Operations,List records where customer_name begins with 'Inc'.,"df[df['customer_name'].str.startswith('Inc', na=False)]",customer_name,
Text/String Operations,List all records where department includes 'Manager'.,"df[df['department'].str.contains('Manager', case=False, na=False)]",department,
Text/String Operations,Get rows where category field has the substring 'sales'.,"df[df['category'].str.contains('sales', case=False, na=False)]",category,
Text/String Operations,Get rows where department field has the substring 'Service'.,"df[df['department'].str.contains('Service', case=False, na=False)]",department,
Text/String Operations,Get rows where product_name field has the substring 'Inc'.,"df[df['product_name'].str.contains('Inc', case=False, na=False)]",product_name,
Text/String Operations,Find customer_name values that contain 'Manager' case-insensitively.,"df[df['customer_name'].str.contains('Manager', case=False, na=False)]",customer_name,
Text/String Operations,List all records where city includes 'Store'.,"df[df['city'].str.contains('Store', case=False, na=False)]",city,
Text/String Operations,Filter rows where email contains 'North' substring.,"df[df['email'].str.contains('North', case=False, na=False)]",email,
Text/String Operations,List records where city begins with 'Manager'.,"df[df['city'].str.startswith('Manager', na=False)]",city,
Text/String Operations,List records where city begins with 'com'.,"df[df['city'].str.startswith('com', na=False)]",city,
Text/String Operations,Get rows where city field has the substring 'tech'.,"df[df['city'].str.contains('tech', case=False, na=False)]",city,
Text/String Operations,Find customer_name values that contain 'Inc' case-insensitively.,"df[df['customer_name'].str.contains('Inc', case=False, na=False)]",customer_name,
Text/String Operations,List all records where city includes 'Inc'.,"df[df['city'].str.contains('Inc', case=False, na=False)]",city,
Text/String Operations,List records where department begins with 'New'.,"df[df['department'].str.startswith('New', na=False)]",department,
Text/String Operations,List all records where customer_name includes 'Service'.,"df[df['customer_name'].str.contains('Service', case=False, na=False)]",customer_name,
Text/String Operations,Find department values that contain 'Store' case-insensitively.,"df[df['department'].str.contains('Store', case=False, na=False)]",department,
Text/String Operations,List records where category begins with 'tech'.,"df[df['category'].str.startswith('tech', na=False)]",category,
Text/String Operations,Get rows where customer_name starts with 'tech'.,"df[df['customer_name'].str.startswith('tech', na=False)]",customer_name,
Text/String Operations,List all records where city includes 'New'.,"df[df['city'].str.contains('New', case=False, na=False)]",city,
Text/String Operations,Find product_name values that contain 'North' case-insensitively.,"df[df['product_name'].str.contains('North', case=False, na=False)]",product_name,
Text/String Operations,Show entries where city ends with 'Pro'.,"df[df['city'].str.endswith('Pro', na=False)]",city,
Text/String Operations,Find all category that contain the word 'tech'.,"df[df['category'].str.contains('tech', case=False, na=False)]",category,
Text/String Operations,Show entries where department ends with 'Service'.,"df[df['department'].str.endswith('Service', na=False)]",department,
Text/String Operations,Get rows where product_name starts with 'Store'.,"df[df['product_name'].str.startswith('Store', na=False)]",product_name,
Text/String Operations,Find email values that contain 'Service' case-insensitively.,"df[df['email'].str.contains('Service', case=False, na=False)]",email,
Text/String Operations,Get rows where city field has the substring 'New'.,"df[df['city'].str.contains('New', case=False, na=False)]",city,
Text/String Operations,Find all city that contain the word 'Service'.,"df[df['city'].str.contains('Service', case=False, na=False)]",city,
Text/String Operations,Get rows where product_name starts with 'Manager'.,"df[df['product_name'].str.startswith('Manager', na=False)]",product_name,
Text/String Operations,Get rows where product_name field has the substring 'Store'.,"df[df['product_name'].str.contains('Store', case=False, na=False)]",product_name,
Text/String Operations,Find all customer_name that contain the word 'New'.,"df[df['customer_name'].str.contains('New', case=False, na=False)]",customer_name,
Text/String Operations,Find all values in city that end with 'Inc'.,"df[df['city'].str.endswith('Inc', na=False)]",city,
Text/String Operations,List all records where product_name includes 'North'.,"df[df['product_name'].str.contains('North', case=False, na=False)]",product_name,
Text/String Operations,Find all entries with category matching 'Store' exactly.,df[df['category'] == 'Store'],category,
Text/String Operations,Find all values in customer_name that end with 'North'.,"df[df['customer_name'].str.endswith('North', na=False)]",customer_name,
Text/String Operations,Find all entries with email matching 'Service' exactly.,df[df['email'] == 'Service'],email,
Text/String Operations,Find category values that contain 'Manager' case-insensitively.,"df[df['category'].str.contains('Manager', case=False, na=False)]",category,
Text/String Operations,Find category values that contain 'Store' case-insensitively.,"df[df['category'].str.contains('Store', case=False, na=False)]",category,
Text/String Operations,Find all category that contain the word 'Inc'.,"df[df['category'].str.contains('Inc', case=False, na=False)]",category,
Text/String Operations,List all records where department includes 'sales'.,"df[df['department'].str.contains('sales', case=False, na=False)]",department,
Text/String Operations,Find department values that contain 'Inc' case-insensitively.,"df[df['department'].str.contains('Inc', case=False, na=False)]",department,
Text/String Operations,Show entries where customer_name ends with 'New'.,"df[df['customer_name'].str.endswith('New', na=False)]",customer_name,
Text/String Operations,List records where product_name begins with 'New'.,"df[df['product_name'].str.startswith('New', na=False)]",product_name,
Text/String Operations,Find all email that contain the word 'Service'.,"df[df['email'].str.contains('Service', case=False, na=False)]",email,
Text/String Operations,Find all values in email that end with 'tech'.,"df[df['email'].str.endswith('tech', na=False)]",email,
Text/String Operations,Find all customer_name that contain the word 'tech'.,"df[df['customer_name'].str.contains('tech', case=False, na=False)]",customer_name,
Text/String Operations,Find department values that contain 'Service' case-insensitively.,"df[df['department'].str.contains('Service', case=False, na=False)]",department,
Text/String Operations,Get rows where department starts with 'sales'.,"df[df['department'].str.startswith('sales', na=False)]",department,
Text/String Operations,Find department values that contain 'Store' case-insensitively.,"df[df['department'].str.contains('Store', case=False, na=False)]",department,
Text/String Operations,List all records where email includes 'Inc'.,"df[df['email'].str.contains('Inc', case=False, na=False)]",email,
Text/String Operations,List records where customer_name begins with 'New'.,"df[df['customer_name'].str.startswith('New', na=False)]",customer_name,
Text/String Operations,Find customer_name values that contain 'Inc' case-insensitively.,"df[df['customer_name'].str.contains('Inc', case=False, na=False)]",customer_name,
Text/String Operations,Find all customer_name that contain the word 'tech'.,"df[df['customer_name'].str.contains('tech', case=False, na=False)]",customer_name,
Text/String Operations,Find all values in department that end with 'Store'.,"df[df['department'].str.endswith('Store', na=False)]",department,
Text/String Operations,Find email values that contain 'Inc' case-insensitively.,"df[df['email'].str.contains('Inc', case=False, na=False)]",email,
Text/String Operations,Get rows where department field has the substring 'tech'.,"df[df['department'].str.contains('tech', case=False, na=False)]",department,
Text/String Operations,Find all entries with city matching 'North' exactly.,df[df['city'] == 'North'],city,
Text/String Operations,List records where email begins with 'Service'.,"df[df['email'].str.startswith('Service', na=False)]",email,
Text/String Operations,Get rows where category starts with 'Pro'.,"df[df['category'].str.startswith('Pro', na=False)]",category,
Text/String Operations,Find all entries with department matching 'com' exactly.,df[df['department'] == 'com'],department,
Text/String Operations,Find all values in city that end with 'Pro'.,"df[df['city'].str.endswith('Pro', na=False)]",city,
Text/String Operations,Get rows where customer_name starts with 'Store'.,"df[df['customer_name'].str.startswith('Store', na=False)]",customer_name,
Text/String Operations,Find all values in product_name that end with 'tech'.,"df[df['product_name'].str.endswith('tech', na=False)]",product_name,
Text/String Operations,Find all values in product_name that end with 'New'.,"df[df['product_name'].str.endswith('New', na=False)]",product_name,
Text/String Operations,Get rows where category field has the substring 'Service'.,"df[df['category'].str.contains('Service', case=False, na=False)]",category,
Text/String Operations,Find customer_name values that contain 'Store' case-insensitively.,"df[df['customer_name'].str.contains('Store', case=False, na=False)]",customer_name,
Text/String Operations,Find all entries with department matching 'Service' exactly.,df[df['department'] == 'Service'],department,
Text/String Operations,Get rows where email starts with 'com'.,"df[df['email'].str.startswith('com', na=False)]",email,
Text/String Operations,Find all entries with city matching 'com' exactly.,df[df['city'] == 'com'],city,
Text/String Operations,Get rows where customer_name starts with 'com'.,"df[df['customer_name'].str.startswith('com', na=False)]",customer_name,
Text/String Operations,Find all entries with department matching 'Service' exactly.,df[df['department'] == 'Service'],department,
Text/String Operations,Find department values that contain 'Manager' case-insensitively.,"df[df['department'].str.contains('Manager', case=False, na=False)]",department,
Text/String Operations,List records where product_name begins with 'Service'.,"df[df['product_name'].str.startswith('Service', na=False)]",product_name,
Text/String Operations,Get rows where city starts with 'tech'.,"df[df['city'].str.startswith('tech', na=False)]",city,
Text/String Operations,Filter rows where product_name contains 'Manager' substring.,"df[df['product_name'].str.contains('Manager', case=False, na=False)]",product_name,
Text/String Operations,List records where product_name begins with 'North'.,"df[df['product_name'].str.startswith('North', na=False)]",product_name,
Text/String Operations,Get rows where email field has the substring 'Pro'.,"df[df['email'].str.contains('Pro', case=False, na=False)]",email,
Text/String Operations,List all records where category includes 'com'.,"df[df['category'].str.contains('com', case=False, na=False)]",category,
Text/String Operations,Find all values in email that end with 'Service'.,"df[df['email'].str.endswith('Service', na=False)]",email,
Text/String Operations,Find all customer_name that contain the word 'tech'.,"df[df['customer_name'].str.contains('tech', case=False, na=False)]",customer_name,
Text/String Operations,List records where customer_name begins with 'tech'.,"df[df['customer_name'].str.startswith('tech', na=False)]",customer_name,
Text/String Operations,Get rows where department field has the substring 'Service'.,"df[df['department'].str.contains('Service', case=False, na=False)]",department,
Text/String Operations,Get rows where product_name starts with 'Store'.,"df[df['product_name'].str.startswith('Store', na=False)]",product_name,
Text/String Operations,List all records where department includes 'New'.,"df[df['department'].str.contains('New', case=False, na=False)]",department,
Text/String Operations,Find category values that contain 'Pro' case-insensitively.,"df[df['category'].str.contains('Pro', case=False, na=False)]",category,
Text/String Operations,List records where email begins with 'Inc'.,"df[df['email'].str.startswith('Inc', na=False)]",email,
Text/String Operations,List all records where product_name includes 'Service'.,"df[df['product_name'].str.contains('Service', case=False, na=False)]",product_name,
Text/String Operations,Get rows where department starts with 'New'.,"df[df['department'].str.startswith('New', na=False)]",department,
Text/String Operations,Get rows where department field has the substring 'tech'.,"df[df['department'].str.contains('tech', case=False, na=False)]",department,
Text/String Operations,List records where department begins with 'tech'.,"df[df['department'].str.startswith('tech', na=False)]",department,
Text/String Operations,Find all entries with email matching 'Service' exactly.,df[df['email'] == 'Service'],email,
Text/String Operations,find company_name ending in Sales,"df[df['company_name'].str.endswith('sales', na=False)]",company_name,
Text/String Operations,find email ending in salez,"df[df['email'].str.endswith('sales', na=False)]",email,
Text/String Operations,department has 'managr' in it,"df[df['department'].str.contains('manager', case=False, na=False)]",department,
Text/String Operations,product_name has word salez,"df[df['product_name'].str.contains('sales', case=False, na=False)]",product_name,
Text/String Operations,city has 'Manager' in it,"df[df['city'].str.contains('manager', case=False, na=False)]",city,
Text/String Operations,get records with product_name beginning as Tech,"df[df['product_name'].str.startswith('tech', na=False)]",product_name,
Text/String Operations,get values with product_name trailing with dotcom,"df[df['product_name'].str.endswith('.com', na=False)]",product_name,
Text/String Operations,find rows where email includes 'Manager',"df[df['email'].str.contains('manager', case=False, na=False)]",email,
Text/String Operations,email has word mngr,"df[df['email'].str.contains('manager', case=False, na=False)]",email,
Text/String Operations,get records with job_title beginning as mngr,"df[df['job_title'].str.startswith('manager', na=False)]",job_title,
Text/String Operations,show rows where city starts with dotcom,"df[df['city'].str.startswith('.com', na=False)]",city,
Text/String Operations,product_name field holds value support,"df[df['product_name'].str.contains('support', case=False, na=False)]",product_name,
Text/String Operations,city has word hiringg,"df[df['city'].str.contains('hiring', case=False, na=False)]",city,
Text/String Operations,find email ending in dotcom,"df[df['email'].str.endswith('.com', na=False)]",email,
Text/String Operations,get values with product_name trailing with Pro,"df[df['product_name'].str.endswith('pro', na=False)]",product_name,
Text/String Operations,get values with job_title trailing with inc.,"df[df['job_title'].str.endswith('inc', na=False)]",job_title,
Text/String Operations,find rows where email includes 'manager',"df[df['email'].str.contains('manager', case=False, na=False)]",email,
Text/String Operations,get records with job_title beginning as pro,"df[df['job_title'].str.startswith('pro', na=False)]",job_title,
Text/String Operations,find product_name ending in Manager,"df[df['product_name'].str.endswith('manager', na=False)]",product_name,
Text/String Operations,find department ending in support,"df[df['department'].str.endswith('support', na=False)]",department,
Text/String Operations,list where department ends with INC,"df[df['department'].str.endswith('inc', na=False)]",department,
Text/String Operations,show rows where city starts with sup,"df[df['city'].str.startswith('support', na=False)]",city,
Text/String Operations,job_title has word managr,"df[df['job_title'].str.contains('manager', case=False, na=False)]",job_title,
Text/String Operations,list where city ends with hiringg,"df[df['city'].str.endswith('hiring', na=False)]",city,
Text/String Operations,department field begins with dotcom,"df[df['department'].str.startswith('.com', na=False)]",department,
Text/String Operations,find city ending in Manager,"df[df['city'].str.endswith('manager', na=False)]",city,
Text/String Operations,job_title field begins with Pro,"df[df['job_title'].str.startswith('pro', na=False)]",job_title,
Text/String Operations,find department ending in managr,"df[df['department'].str.endswith('manager', na=False)]",department,
Text/String Operations,get values with email trailing with manager,"df[df['email'].str.endswith('manager', na=False)]",email,
Text/String Operations,list where company_name ends with .COM,"df[df['company_name'].str.endswith('.com', na=False)]",company_name,
Text/String Operations,find rows where city includes 'Sales',"df[df['city'].str.contains('sales', case=False, na=False)]",city,
Text/String Operations,find city ending in support,"df[df['city'].str.endswith('support', na=False)]",city,
Text/String Operations,list where department ends with Hiring,"df[df['department'].str.endswith('hiring', na=False)]",department,
Text/String Operations,show all department with tech in it,"df[df['department'].str.contains('tech', case=False, na=False)]",department,
Text/String Operations,find rows where product_name includes 'TECH',"df[df['product_name'].str.contains('tech', case=False, na=False)]",product_name,
Text/String Operations,job_title has 'mngr' in it,"df[df['job_title'].str.contains('manager', case=False, na=False)]",job_title,
Text/String Operations,product_name has word INC,"df[df['product_name'].str.contains('inc', case=False, na=False)]",product_name,
Text/String Operations,show rows where email starts with sales,"df[df['email'].str.startswith('sales', na=False)]",email,
Text/String Operations,get records with product_name beginning as TECH,"df[df['product_name'].str.startswith('tech', na=False)]",product_name,
Text/String Operations,find department ending in Manager,"df[df['department'].str.endswith('manager', na=False)]",department,
Text/String Operations,get records with email beginning as Support,"df[df['email'].str.startswith('support', na=False)]",email,
Text/String Operations,job_title has 'hire' in it,"df[df['job_title'].str.contains('hiring', case=False, na=False)]",job_title,
Text/String Operations,company_name field holds value Sales,"df[df['company_name'].str.contains('sales', case=False, na=False)]",company_name,
Text/String Operations,show rows where department starts with pro,"df[df['department'].str.startswith('pro', na=False)]",department,
Text/String Operations,department has word inc.,"df[df['department'].str.contains('inc', case=False, na=False)]",department,
Text/String Operations,show rows where email starts with INC,"df[df['email'].str.startswith('inc', na=False)]",email,
Text/String Operations,get values with product_name trailing with dotcom,"df[df['product_name'].str.endswith('.com', na=False)]",product_name,
Text/String Operations,find product_name ending in Support,"df[df['product_name'].str.endswith('support', na=False)]",product_name,
Text/String Operations,product_name field begins with TECH,"df[df['product_name'].str.startswith('tech', na=False)]",product_name,
Text/String Operations,get entries if department contains .com,"df[df['department'].str.contains('.com', case=False, na=False)]",department,
Text/String Operations,get rows where product_name does not contain 'suport',"df[~df['product_name'].str.contains('suport', case=False, na=False)]",product_name,
Text/String Operations,get rows where company_name does not contain '.COM',"df[~df['company_name'].str.contains('.COM', case=False, na=False)]",company_name,
Text/String Operations,find email having 'tech' and company_name with 'hiringg',"df[df['email'].str.contains('tech', case=False, na=False) & df['company_name'].str.contains('hiringg', case=False, na=False)]",email,
Text/String Operations,get rows where product_name does not contain 'tek',"df[~df['product_name'].str.contains('tek', case=False, na=False)]",product_name,
Text/String Operations,find department having 'support' and job_title with 'inc.',"df[df['department'].str.contains('support', case=False, na=False) & df['job_title'].str.contains('inc.', case=False, na=False)]",department,
Text/String Operations,get rows where company_name does not contain 'hiring',"df[~df['company_name'].str.contains('hiring', case=False, na=False)]",company_name,
Text/String Operations,find company_name having 'salez' and product_name with 'managr',"df[df['company_name'].str.contains('salez', case=False, na=False) & df['product_name'].str.contains('managr', case=False, na=False)]",company_name,
Text/String Operations,find department having 'salez' and email with 'sales',"df[df['department'].str.contains('salez', case=False, na=False) & df['email'].str.contains('sales', case=False, na=False)]",department,
Text/String Operations,get rows where product_name does not contain 'Sales',"df[~df['product_name'].str.contains('Sales', case=False, na=False)]",product_name,
Text/String Operations,get rows where email does not contain 'support',"df[~df['email'].str.contains('support', case=False, na=False)]",email,
Text/String Operations,list records where department has 'dotcom' or company_name has 'dotcom',"df[df['department'].str.contains('dotcom', case=False, na=False) | df['company_name'].str.contains('dotcom', case=False, na=False)]",department,
Text/String Operations,get rows where department does not contain 'inc.',"df[~df['department'].str.contains('inc.', case=False, na=False)]",department,
Text/String Operations,find job_title having 'managr' and city with '.com',"df[df['job_title'].str.contains('managr', case=False, na=False) & df['city'].str.contains('.com', case=False, na=False)]",job_title,
Text/String Operations,get rows where department does not contain 'tek',"df[~df['department'].str.contains('tek', case=False, na=False)]",department,
Text/String Operations,get rows where department does not contain 'hiring',"df[~df['department'].str.contains('hiring', case=False, na=False)]",department,
Text/String Operations,get rows where product_name does not contain 'PRo',"df[~df['product_name'].str.contains('PRo', case=False, na=False)]",product_name,
Text/String Operations,find city having 'dotcom' and product_name with 'pr0',"df[df['city'].str.contains('dotcom', case=False, na=False) & df['product_name'].str.contains('pr0', case=False, na=False)]",city,
Text/String Operations,list records where product_name has 'Tech' or job_title has 'PRo',"df[df['product_name'].str.contains('Tech', case=False, na=False) | df['job_title'].str.contains('PRo', case=False, na=False)]",product_name,
Text/String Operations,list records where department has '.com' or job_title has 'hiring',"df[df['department'].str.contains('.com', case=False, na=False) | df['job_title'].str.contains('hiring', case=False, na=False)]",department,
Text/String Operations,list records where job_title has 'sup' or product_name has '.com',"df[df['job_title'].str.contains('sup', case=False, na=False) | df['product_name'].str.contains('.com', case=False, na=False)]",job_title,
Text/String Operations,list records where product_name has 'support' or job_title has 'Sales',"df[df['product_name'].str.contains('support', case=False, na=False) | df['job_title'].str.contains('Sales', case=False, na=False)]",product_name,
Text/String Operations,find email having 'salez' and job_title with 'dotcom',"df[df['email'].str.contains('salez', case=False, na=False) & df['job_title'].str.contains('dotcom', case=False, na=False)]",email,
Text/String Operations,find job_title having 'mngr' and company_name with 'hiringg',"df[df['job_title'].str.contains('mngr', case=False, na=False) & df['company_name'].str.contains('hiringg', case=False, na=False)]",job_title,
Text/String Operations,list records where job_title has 'sales' or product_name has 'ink',"df[df['job_title'].str.contains('sales', case=False, na=False) | df['product_name'].str.contains('ink', case=False, na=False)]",job_title,
